<?xml version="1.0" encoding="UTF-8"?>
<xsd:schema xmlns:xsd="http://www.w3.org/2001/XMLSchema" targetNamespace="http://uvit.math.rs" xmlns="http://uvit.math.rs" elementFormDefault="qualified">
  <xsd:element name="listaPoruka" type="ListaPorukaType" />
  <xsd:complexType name="ListaPorukaType">
    <xsd:sequence>
      <xsd:element name="pismo" type="PorukaType" maxOccurs="unbounded" />
    </xsd:sequence>
  </xsd:complexType>
  <xsd:complexType name="PorukaType">
    <xsd:all>
      <xsd:element name="prima" type="xsd:string" />
      <xsd:element name="salje" type="xsd:string" />
      <xsd:element name="naslov" type="xsd:string" />
      <xsd:element name="tekst" type="xsd:string" />
    </xsd:all>
  </xsd:complexType>

</xsd:schema>