<?xml version="1.0" encoding="UTF-8"?>
<!-- OK - lista pismo moze da bude jednoclana
-->

<listaPoruka xmlns="http://uvit.math.rs" 
xmlns:xsi="http://www.w3.org/2001/XMLSchema-instance" 
xsi:schemaLocation="http://uvit.math.rs lista-poruka-struktura.xsd">
  <pismo>
    <prima>Sanja</prima>
    <salje>Vlado</salje>
    <naslov>Podsetnik</naslov>
    <tekst>Kupi karte za utakmicu</tekst>
  </pismo>
  <pismo>
    <salje>Sanja</salje>
    <prima>Vlado</prima>
    <naslov></naslov>
    <tekst>Kupila :)</tekst>
  </pismo>

</listaPoruka>